"Title","Content","Rating"
"Poor acting of the lead actor","Considering the high rating of the users, my expectations were high, but still, the series was well made and good. It was an attractive drama. The slow rhythm of the series may has offended some audiences, but this slow rhythm was in perfect harmony with traditional Japanese culture. In fact, the relationship between form and content makes it acceptable. The series had several weaknesses, the most important of which was the choice of actor Anjin(blackthorn). Very poor acting with exaggerated and silly facial expressions and the way he spoke were annoying throughout the ten episodes of the series. In fact, this poor performance by the one of lead actors has given a big blow to the quality of the series.",7
"New is not better","As an old man, who enjoyed the true story, the book, so much I read-it several times during last decades, and as a man who watched the ORIGINAL series, more than 40 years ago, I was deeply disappointed with the ""new"" version.The acting skills are mediocre at best, miserable for most parts, the director took the liberty to ignore the book and started inventing BS, the music is awful, and overall, I cannot stop comparing Richard Chamberlain and. Toshiro Mifune with the pathetic, crappy ""actors"" in this ""new"" version.Annoying to see so much hype from the young generation, for a mediocre, even miserable remake, who throw the real story to the garbage bin, yet get acclaimed with 9 or even 10 stars of 10...
Obvious these peoples never bother to read the book, and for sure, they never watched Richard Chamberlain and Toshiro Mifune version - real actors, unlike the pathetic clowns on this production...
CGI effects and ""diversity"" crews will not bring authenticity, nor quality, alone, if it is no talent and no respect for the book who brought this story to the light.I stopped watching after the first episode, so much it hurt my expectations... I will not recommend at all this - the 1980 version is like an old, savvy wine, and this CGI version is like a synthetic , sugar-free, warm can of Coke, who somebody forgot in the sun weeks ago ... .",2
"Great expectations, but fails to live up to the hype","While Shogun impressively captures the essence of medieval Japanese culture with stunning visuals and a talented cast, its pacing falters, particularly in episodes 5-7, which feel like ""snooze-fests"" bogged down by unnecessary plotlines and characters. The action sequences, unfortunately, lack the energy and excitement expected.Mariko emerges as a standout character, showcasing strength and depth, but her backstory remains underdeveloped, leaving her potential untapped. Additionally, pivotal character deaths are glossed over, missing opportunities for emotional resonance and closure.Overall, Shogun falls short of greatness due to its meandering focus, preventing it from fully realizing its promising premise and characters.",7
"This is devoid of intelligence, charm or wit!","For 5 years I have been looking forward to this! The reinvention of a great book and a great tv-series! But it is without charm, without nerve, without credibility! Cosmo and Sawai are boring - and there is no credible romance between them, no chemistry at all. The new plot no longer trails the adventure of John Blackthorne but reduces him to an imaterial sidekick! And why change the books brilliant plot? Why anyone would like this is beyond me! But it will have one obvious consequence: I will unsubscribe Disney + after this - If for no other reason! - it was the final straw! This is not Clavell's Shogun so do not advertise it as such!",1
"A little less conversation, a little more action, please","Series started out strong and absolutely beautiful, but then it is just characters talking and more talking and planning and scheming and talking about setting plans in motion but nothing is shown. It is not epic, just bunch of people talking.Also, what is up with all the suicide. I mean it is so silly after a while. I looked at you wrong: Suicide. I am gonna drown: Suicide. I raised my voice in your house: Suicide. I don't agree with you: Suicide. I mean jeez!!! It was off putting and am quite sure over blown representation.I did like the slow burn romance between Lady Mariko and Anjin-San. But that was that. I was hoping for a big battle scene or something epic which never happened, just talks of it happening. So yeah, 6 stars.",6
"It falls short of both the book as its eighties predecessor","The new series take a lot of liberty in the story telling unlike the book or the original 80s series. As I have read and seen those, I can explain to my spouse and kids what is happening. Although the first episodes did follow the book closely, more and more it deviates on important events. As if the budget would not allow further elaboration. Without me explaining to my family what is happening, I doubt whether they can actually understand what is exactly going on and who is who. Also the bad guys are not so devious as in the book or the original series. The scenes, costumes, sword dueling and so on are very good and give a nice view of feudal Japan. It is a good series to watch but not as epic as the original series. As such I do not understand the very high rating.",3
"A cracker for the starving","To quote Eddie Murphy:
""If you're starving and somebody throw you a cracker you gonna be like this: Goddang, that's the best cracker I ever ate in my life!""Shogun is such a cracker.It's an ok show, but nothing special compared to actually great TV shows.However, we live in a time of DEI-infested garbage entertainment and bad writing, so regular audiences have a hunger for TV shows and movies that at least don't suck.Shogun isn't bad, but it's not great either.Production quality is high and the acting is fine, albeit Cosmo Jarvis comes across as a caricature in the main role.The pacing is slow and it's very hard to get invested in any of the plethora of characters, or the uncompelling plotline. I wouldn't call it boring, but just too much work for too little payoff.While I understand the high rating when compared to what else is out there right now, please don't expect a show that can compete with a pre-woke era show with a 9+ rating.It's a nice cracker, but that's all.",6
"Oh Heck No","I was so excited when I heard about this. I remembered adoring the 1980 version so much that it spurred me to read the novel.But oh my god. No, no, no, a thousands times no.Talk about unfaithful to the novel! $!?!RC was a great Blackthorne! CJ... not so much.The relationship between Mariko and Blackthorne, as written by Clavell - the engine that drives the novel and makes it great - is faithfully represented in the 1980s version but completely bastardized in this dreadful remake. I was heartbroken when Mariko died in the original version; I felt absolutely nothing this time around - which pretty much says it all.Last but not least... the 1980s version was filmed entirely in Japan. The remake? Filmed entirely in... British Columbia. #facepalm.",3
"Underwhelming","On the plus side, the production was top notch with nice costumes and CGI.However, the crux of this series can be summed up with that old favorite phrase from the Seinfeld TV series, ""Yadda Yadda Yadda, Blah Blah Blah"". Not only is the dialog dull, inane, and mostly pointless; it goes on forever and ever, without taking you anywhere (admittedly it is occasionally interrupted by some interesting action sequences). By the tenth episode I was glad that it had ended.Other drawbacks are:The character of Blackthorne. I don't know if it was the actor, director, or script, but this character was dull, boorish, and obnoxious (and he always had this confused, dumb look on his face). This is not something you want in a protagonist.Mariko's character was uninteresting and boring. I did not even feel sad when she met her demise; my reaction was more ""Oh well"" (shrug).",6
"Show Gone With the Wind","In the movie business, you can either confuse the audience about what is happening or make them eager to know where the movie is headed, but you have to answer all these questions or have a strong ending. And this shogun mini-series has both an element of confusion and what's going to happen at the end. And it failed in both of them. It was very slow and boring, with long dialogues. However, I reassure myself that these details will be the key to solving the questions at the end. But the last episode was very disappointing. Instead of depicting what happens to the other characters and portraying the upcoming war, it shows John's dream with his grandchildren or a lot of trivial things instead of what we really expect to see. When I watch a movie, I want to see the conclusion or understand the director's message. However, nowadays, some movies have ambiguous endings, and we often resort to watching multiple clips on YouTube to reveal the true direction of the movie. Dear director, I'm a moviegoer and not Sherlock Holmes or Hercule Poirot to guess what's going on your movie.",1
"Stunning cinematography, taut direction, poor story telling","James Clavell was one of the most remarkable writers of his time. Not only did he himself live an incredible life, he wrote extraordinary stories with an unbelievable range of topic and mood, everything from horror to adventure to crime. His screenplays included The Fly, The Great Escape, and To Sir with Love. (His politics, however, were unfortunate, being a rightwing libertarian. No one is perfect.)The reason he could do all this is that the art of excellent narration was second nature to him; he was born a natural story teller. Unfortunately, this adaption of his best selling novel leaves the clear, lucid narration behind. Admittedly, Clavell had more room in his novel that this series has, but the people behind this show, rather than emulate Clavell's genius, have opted for a confusing script that is hard to follow and sometimes seems to meander off into oblivion. A shame, as everything else is here: great direction, superb acting, and above all, extraordinarily luscious sets filmed with precision and clarity: everything the script somehow avoids.",6
"Feudal Canada","This is one show which would've benefited by being shot on location. The unmistakable evergreen forests of Canada immediately breaks a sense of immersion.The story feels low stakes, with boring subplots and meandering political machinations. Two ridiculous scenes in the pilot would give Tarantino an orgasm. A group of Japanese soldiers are almost overcome by a starving, weak pirate and in the same scene one of the said soldier has his sword taken from him by one of the weakened pirates. They had diversity behind the camera but still played the Western fantasy of overcoming Eastern might with ease.The show will probably do gangbuster numbers for the first few episodes but interest will fall if they don't pick up the slack. The characters at this stage are too thin, especially the Japanese who come across as one-dimensional and, in some cases, caricatures.",4
"If you expect S2 you're at the wrong place","I'm not familiar with the original book the show is based on, but after watching the final episode, there was one word that came to my mind: Seinfeld. Or as people call ""the show about nothing"".The reason why is because the title of the show ""Shogun"", doesn't exist in the story. Yes we get a 1 minute sneak peek about Toranaga's intentions, but it's just a plan, a dream. And of course the whole show is about making him the Shogun because the other side is evil, but in order to achieve his goals he sacrifices literally everyone around him.He's not better, actually worse because he doesn't attack his enemies, he just kills off his allies. And of course you won't see any of plotting, the plans, because the story focuses on others, whose lives actually less important than his. The story that would be interesting happens off screen of after the show, that we will never see.It's a huge disappointment, and I'm not saying that because I wanted more action, I just wanted a good story where things happen on screen. Otherwise I could just go and watch Seinfeld.",6
"Insanely Boring.","I struggled with this. The largest problem in my view is there are just tons of scenes that are boring and really don't have a pay off and or are poorly explained. Such as the Pheasant scene. I had to go to you tube to understand what that was about. The first episode I felt like I had to watch it again because nothing really happened but, no, nothing really happened. That happens a lot.As to the alleged quality... one word..Cosmo Jarvis. He was as bad here as everything I have seen him in. Playing it very odd like he has tics and was not exactly someone I was rooting for. I also didn't believe that he and the main woman character would ever get together because of the time and culture differences.The entire story was meant to be one of those where the main character wins by outsmarting others but that can only be taken so far. The idea that this guy prevailed because he anticipated all of the various things that had to happen in 10 episodes (including an earthquake) is insanity.",1
"A huge build up to a battle we don't see .","Sorry loved the show and the build up but wasn't it all a build up to show the famous battle was I the only one expecting to experience the great battle ,which if you read up on the actual battle would of been a great ending to the story a chess match no one expected with sides changing in the middle of the actual battle but just tell you a little bit of what would actually happen at the battle .Felt a little short changed at the end ,was like watching Napoleon and at the end they skip the battle ...On a plus side thought the acting was excellent but shame we didn't get to see the master plan actually unfold.",6
"LOOSELY based on the book","I've read many of the 10/10, 9/10 reviews, and I beg to differ. While the visuals are strong, the changes made to the book's story are not an improvement on the book. This version makes it hard for me to follow the story, and this telling sheds little light on the vast cultural differences between Japan & Europe that the book and 1980 version capture so well.The actor playing Blackthorne seems like a caricature. It's hard to imagine someone like him actually being accepted into the Japanese fold. The actor playing the Portuguese pilot doesn't work, as well as the actor who played the 1st priest Blackthorne encounters. I was hoping for a much more insightful take on the story, 40 some years after the 1st production, with the technology and cultural discernment available these days.",3
"With all due respect","This reboot is not as good as the original which is one of my favorite tv shows of all time. Despite enjoying the Japanese spoken (I speak it), the characters are not as compelling as the original. They seem to be one dimensional in comparison. Also, the script and storyline is much more haphazard. I can only assume the producers and writers thought this would be a more interesting and complex format. Instead, I feel the actors lack direction and often seem to just be reading the lines as best they can. My main concern though is the lack of character exploration which I feel the original series did in a much better fashion. Seeing Blackthorne become Anjin was a much more fulfilling experience in the original series for example. Still, compared to the typical dribble out there, it's decent.",7
"Sadly... it's mostly about authentic costumes","I had great hopes. I've watched Mr. Sanada acting in different movies and I admire his work. His performance in this one is very good, not his best in my opinion, but very good.Costumes are very nice too. I cannot speak about their authenticity though I don't remember seeing any obi on almost any female character. Not on this remake. I've seen it on all female characters on the 1980 original version.There aren't other good things I can write about it.I read this remake was well received and rated in Japan, compared with the original version which was not. I'm not Japanese and although I watched a lot of Japanese movies, not only the ones made for western viewers, and I read a lot about Japan and its culture, I think this version was made to target both, the eastern and western audiences. The team probably worked hard to do that and I think it shows. While the original version is somewhat cheesy, this one lacks almost any sentiment. It's like the Japanese part of the team had an argument with the western team every time they may have tried to do something to bring any soul to the story. I felt a tension throughout the whole series. It felt restrained and cold. I believe that may have been the intention, more so since they filmed it on rainy, cold, and dark days.The screenplay misses key points from the book, and most of the ones they didn't miss are minimized. I know, it's based on James Clavell's book, not quite loosely, but still, not what the author intended. That is sometimes not bad, that is when the book is not that great, just the idea behind it is. It's not the case with this novel. I don't expect for a team to follow the book exactly, but at least do an acceptable job, if they cannot do better. There really cases in which the movie is better than the book. Not in this case.I think Clavell knew a lot about Japan and its culture. To this point he writes about kissing which is not the way a samurai male or female was showing affection to his/her spouse or lover. In this movie the Blackthorne kissing Mariko scene is a fail. There are ways actors can show love even without touching, but I haven't seen any such scene in this new series. Almost all seppuku scenes in the movie are empty compared to the way they are portrayed in the novel. There is at least one which is better represented in the movie but which is not in the book. Toda Hiromatsu is never committing seppuku but the scene in the movie is very good.The screenplays for different episodes are written by different people and directed by different directors. This is why the whole story is missing unity. It's almost like threads that barely connect.I watched all episodes, some even twice. Overall it's not that bad but for me it was disappointing. I did not enjoy the original much at the time I've seen it in 1980. Not because I read the book previously. Even so, I like it better than this new one. I would not call this new one a remake.",3
"Nice enough, but better read the books.","A good show - good casting, good acting, nice decors, but very, very rushed. In just 4 episodes they cover half of the books, and don't really show how the main character experiences the cultural shock and how he comes to change his views of Japan's culture, and how he comes to understand and accept the culture and customs, it's people and how he adapts to his new life in Japan.If you haven't read the books, you'll probably be thrilled by the show. But if you have read the books - you might be disappointed by how rushed it is the show.I'm giving it a 7.5 (though I'm rounding it down to compensate for all the 10 - who are exaggerated).",7
"Compared to the 80s version, this has no heart....","I remember watching the 80s version of this series back in the 80s, 90s, and 2000s and it had a good story, decent action, and it seemed to keep you wondering and looking forward to the acting.This new version....it's just so bland, so ""default"", doesn't seem to have actors with any heart or spirit. It's like they just got up there and read their parts, cashed their checks, and went home.I mean Joh Rhys-Davies MADE the 1980 show as well as Richard Chamberlain. Together they were dynamic. And the asian actors seemed to have personalities you really wanted to follow.This show, they justy don't have any really impressive spirit to their characters.Others may not agree but i just don't see it in this version...",5
"GREAT SHOW WITH A WEAK ENEDING","So i loved the show, the intencity of scenes and the dialogue was not hard to follow with subtitles. But I just cant rate this any higher, I do love unusual endings in shows and movies, endings that you expect the least but it felt speedrun and skipped. I Awaited an big battle with army vs army to conclude the fight between the clans and that blackthorne would have some part to ensure victoyr for lord toranaga but instead lord toranaga just reveald his plans in the near end of his show and we just have to sit there and imagine he wins the battle. It would have been fun to atleast see a smal part of the battle and atleast get a glimpse of vicory on lord toranaga's side but instead we see the armies in a future timejump as lord toranaga explains his plans and then it cuts back to the present. I know this is how the book end (i have not read it) but atleast a part of the battle could have been fun to see. But for the show overall I can comfortly rate it a 9/10 as i do like these kind of shows (slow drama) because of how intense some scenes can be as it leads up to something big and you can feel it coming slowly witch builds up an satisfying intensity. Great actors great visuals and good to watch if you like history and japan culture :D.",7
"Decent but highly overrated","The show just is about average, leaning high or low depending on my mood. Firstly, the English actor playing John Blackthorne is just cringe-worthy. Has a toyish look on his face in every other scene, going on similarly cartoonish monologues at every opportunity. The best actors were by far the ones playing Lord Toranaga and Yabushige but they too were not perfect. Well of course, perfection is hard to attain but why is the show talked about like it's perfect then? It was far from it. I guess it has the value of novelty for somebody unacquainted with Japanese culture, and something for those with a fetish for interracial romance, but the script while gripping at times was let down because of the over-focus on the English character and his fetishized romance with the suicidal Japanese lady. I think the show would have been far better as a full-on purely Japanese historical drama on the Shogunate. But I suppose having a token white guy who gets naughty with a high-born Japanese woman makes it a lot more alluring to western audiences.",5
"Overhyped but still pretty good","Based on the early reviews I was expecting a LOT from this series. While it was certainly watchable, I don't think it lived up the hype.First of all, the acting was uneven - Cosmo Jarvis for starters who is likable enough but not particularly believable. Generally the Regents and Toronaga were also pretty wooden. The female cast definitely outperformed the men though I did enjoy Yabushige.While there some beautiful scenes, I also thought the cinematography was rather dark and murky too often - the scenes on the water especially were often hard to make out.And where were the battles? The show was promoted as a war drama - there were a few fights and skirmishes, but other than in the credits there weren't any real battle scenes.",7
"Over rated big time","Being a show done in English yet majority of it being in Japanese with needing to read subtitles already lost me I feel I can't really follow a show if I'm constantly reading subtitles so this just felt like I was watching some foreign movie on Netflix without having a dubbed option.I really should have just dropped it after the first few episodes, as it was just boring to me hardly anything happens. I managed to sit through the whole season though thinking it might get better well it does not, there is only a few action scenes in each episode and the rest as I already said is just reading subtitles as the dialogue is in Japanese. I don't see the hype at all with all episodes having an average rating of 8+, and it being renewed for another two seasons. Totally over rated.",3
"Overhyped","The first couple episodes are interesting, the more the show goes on the more boring it becomes. I had to fast forward almost every dialogue through episodes 5-7, at least half the screentime in these episodes was dedicated to drama between Blackthorne and Mariko which is the most dull and tiresome part of the whole film.The whole political power struggle can be interesting but sadly it's not flashed out enough, and then again, the show just tumbles down into weird family drama instead of continuing with the scheming councilours and profit-seeking Portugese. Even though the scheming we are shown also has some flaws, some events/plot twists don't make sense and even made me laugh.There is VERY little action in the show, almost none of it. There is still hope for the episodes to come, but as for episodes 1-7 there is basically 1-2 fighting scenes... in a show about feudal Japan and the samurai.As for the technical part,
the costumes, scenery, athmosphere and VFX overall are good. Almost all dialogues are on Japanese with English subtitles, and it can be a little off-putting after a while, even though it is somewhat understandable because we are shown a dispute between the Western European and Japanese cultures.The acting in the film is decent, not horrible but not a masterpiece either.Overall, the show (so far) is mediocre at best, and feels like a lot of wasted potential. There are some cool scenes, ideas and characters, but it is definitely not the 10/10 show as many proclaim.",4
