"Title","Content","Rating"
"Shogun: a chess game with all the pieces in place but only one player was awarded of it.","'Shogun' is more than just a show; it's a brilliant plan unfolding step by step. From the start, it's like a game of chess, with every move carefully thought out. The way they reveal who wins is just genius. What makes it special is how they mix in love and betrayal, making every moment count. Every character's journey feels important, adding depth to the story. And the best part? It lets you think for yourself, making it exciting every time.The last episode is really satisfying. They tie up all the loose ends and give closure to the stories, which is amazing. It all makes sense, showing how every chess piece was used wisely. Some characters die, but it's done in a meaningful way. They don't cheat by bringing them back.About that spoiler: how they show who wins the battle without actually showing it is just wow. It proves 'Shogun' doesn't need big battles to be exciting. Adding one would have made it less special.",10
"""Shogun"" is a true hidden treasure of a series.","""Shogun"" is a true hidden treasure of a series. Don't let its association with Disney deter you; it boasts breathtaking visual effects and a meticulously crafted storyline. The subtitles, seamlessly translating Japanesse dialogue into English, enhance the show's ambiance. With a stellar cast delivering superior performances, each episode leaves you craving more. Ending at the same point as the book it's based on, the series tantalizingly leaves room for a sequel but with out any more source meterial every thing from now on would be New and Depend solely upon the Writers. Here's hoping any follow-up lives up to the fantastic standard set by Season One.",10
"A must watch!!!","""Shogun"" is a must-watch for anyone into gripping historical dramas. Set during the early days of Tokugawa Ieyasu's reign, the show immerses you in feudal Japan like never before. The attention to detail in the sets and costumes is mind-blowing, making you feel like you've stepped right into the 17th century. Plus, the acting is top-notch, with every cast member delivering performances that draw you in and keep you hooked from start to finish. From the intense political maneuvering to the breathtaking visuals, ""Shogun"" earns a solid 10/10 for its compelling storytelling and immersive world-building.",10
"The ending is perfect to me","I finished the 10 episodes in 2 weekends. It's the best show in a while. Maybe the best show after the first 4 seasons of GOT.First, the acting is simply superb. All the main characters were portraited with such details and subtlety that it's a pure joy to watch. Mahershala Ali won Oscar because he can act with his eye expressions. After watching this series, you will realize that all the main Japanese actors can do it! The smirk on Toranaga's or the smile on Yabushige before he dies was just epic. Obviously Anna Sawai, who played Mariko and Sanada, who played Toranaga, are stars of the show. But Fuji, Yabushige and Kazunari were all excellently portraited with such charm and finesse. The overall acting is 8/10. The points lost were from the main character Cosmo Jarvis who played Blackthorne. His acting was robotic and superficial, and not on par with the rest of the crew. However, maybe this is by design, to illustrate that the character was out of place.Second, the characters. The producers of the show are great story-tellers. Each character carries their own story and therefore their own charm, giving the show such richness to savor. Obviously, this was not possible without the superb acting and directing, on top of the great book.Visuals. Sometimes they used wide angle lenses that deliberately gave some distortions, and sometimes they used lenses with obviously vignetting (the corners appear dark), and they masterfully didn't correct them. Such photographing gave a very unique feeling as if you are watching a real event through a camera lens. The sceneries, especially the Japanese gardens, yards, meeting rooms etc, are esthetically appealing. The Japanese costumes, including the traditional clothing and warrior armors, feel like visiting a live museum!Last but not least, the story was a master piece. I always like series based on true events such as Narcos. Dramatized real events make the best TV. This one is no exception. Nothing felt artificial or strange. All pieces fit well. Some people complain about the ending, claiming it was epic. However, I argue that the ending was perfect. We have seen the main characters and their stories. In the end, we see the real face of Toranaga, the Shogun. And the genius of the Blackthorne character is that it provides a Western view of the characters and events. The most important character of Blackthorne is his empathy for human life, which is in direct conflict with the disregard of human lives way in 17th century Japan, and he provided a bridge to modern viewers. The ending offered a shock without an epic battle scene, and in my view, done masterfully.",10
"Riviting","I cannot find a flaw with acting , direction , nor writing .Such a fantastic show , special effects top notch feel like your in old time Japan and the customers and sets awesome.This is possibly the next big tv show , after GoT .I look forward to Monday nights when the new episode airs .Really makes for a great evening ,The actors are just brilliantly cast , Blackthorn better than say Tom Hardy ( whom I bet they tried to get ) .Just finished episode 5 can hardly wait until next week .Do yourself a favour and watch this , this will go down as one of the great tv shows of all time .",10
"So far, so amazing..","If you are going to remake a classic mini series , this is the was to do it. I won't go into the plot of the series but just to say I am so far very impressed at how these first 2 episodes have panned out. The original 1980's series was very impressive for its time and Is worth checking out if you haven't seen it.But this remake has so far proved to be superior in scope and attention to detail and script. The acting and characterisation is sublime.Obviously a lot of research has gone into the production and the casting of the main characters. I would recommend anyone interested in this period of history to check it out.",9
"It's living up to its mark","The anticipation for this show has been crazy, and so far is staying very close to the original story what's sad thing about it is the subtitles are moving so fast you don't have time to read it all which is very disappointing. At this day and time the Japanese language should be represented but slow it down some, we all are not fast readers. The patent tree is absolutely excellent and you're learning the true culture of the Japanese people in the 16th century which we may see as harsh but what culture isn't harsh. We all don't live in a better roses. I can't wait to see how this is going to end.",8
"This is what television has been missing in recent years","This show was incredible. I have not felt this pulled into a series in years. The only things in recent memory I can compare it to are The Bear and House of the Dragon in terms of the elaborate storytelling and compelling characters. I am yearning for more after the credits role on episode 10, and yet I feel there was no better way for them to have ended it. I adored the characters, and mourn for those that were lost that I had grown fond of. This is the quality I expect from channels such as FX and Max, and I am glad that this series delivered what it promised during all of the marketing prior to its release. A must-watch for drama and period-piece fans. 9/10.",9
"Go Back and Watch the Original","As someone who's a big fan of the original miniseries with Richard Chamberlain, this version leaves a lot to be desired. For starters, the original series is faithful to novel, which is an excellent read (I've read it 3x), whereas this version departs from the original story often. The dark filters and modern music are just dumb choices. No Japanese music for some reason. The best actors in this new version are those playing Toranaga and Kasigi Yabu (no idea where ""Yabushige"" comes from--not in the book or original series). The guy playing Blackthorne is a terrible actor for this role; he comes off like he's about to have a seizure at any moment. So many additional story changes with this version too. For some reason, the writers decided to make Ochiba a conniving, power-hungry woman (not so in the book). Do yourself a favor and watch the original series after this. I think you'll find it's much, much better.",6
"It made me rewatch the far superior 1980s mini series","It's funny that a 10 hour ""mini"" series is actually longer than the 10 episode ""normal"" series of 2024. And this is the main problem with this show, it was ""modernized"" for ""modern"" audiences. Something a show about 17th century feudal Japan does not need.We have all the tropes of modern shows - cliff hangers, extremely long and pointless establishing shots, ""witty"" dialogue, gray and brown tones for ""realism"", and pointless changes to the original story for no apparent reason.Do yourself a favor and watch the 1980s show instead. It's superior in pretty much every way, and was actually shot in Japan, unlike the new one that was shot in Canada for some reason.",1
"Stunning and nostalgic","20 years ago I'd heard about an amazing TV show produced in the 1980's called Shogun. The production took great care of bringing Japanese culture to life. I then began reading all of James Clavell's works. From the multi-hundred page sailing adventures to the meticulous thoughts of hearing every villagers thoughts as events were unfolding.The new series is everything just as good as the original TV production and brings a level of quality that fully modernizes a setting from the 1600's. I got to relive my fond memories of Blackthorne and Mariko.There was sort of fond sadness seeing this show draw to a conclusion. Emotions are displayed in subtle manners which left capacity for my own thoughts and feelings. I remembered how much these works meant to me 20 years ago and I'm lucky to feel the appreciation I have now.",10
"""Flowers are only flowers because they fall""","An absolute masterpiece that leaves you wanting more.We won't ever get more Shogun sadly, but maybe that's for the better, because it was the perfect miniseries.It was so refreshing to see a show cover such a rarely covered time period and setting - 1600s Japan towards the beginning of a period of Christian and European influence.The casting was impeccable for both main and supporting characters, especially the roles of Mariko, Toranaga, and Ochiba. Anna Sawai deserves an Emmy for this one.The score was incredible throughout, the show but really came through when it mattered most - in the finale.The storytelling and character development really are what shine through though. While Shogun will draw comparisons to shows like Game of Thrones, is more similar to a game of chess than an action movie. It's poetry in motion and the best miniseries since Band of Brothers.",10
"From writing, acting and production standpoint, it's probably the best show I've ever seen!","I've never read the source material and I hardly ever write reviews, so when I do, it's either very good or very bad. This show was very, very good.These are the few things that I loved about it.I love that a majority of the cast and crew are Japanese as requested by Senada and co. The make up, costumes, set decoration, mannerisms, historical accuracy, time period language etc - all genuine. As this show is based on a book that is based on historical figures, all the authenticity helps the cast to fully immerse themselves into their roles, thereby giving a much more accurate and fuller performance. And with 70% of the show being in the Japanese language, this also helps the audience immerse themselves into the show too.The idea of this show was 11 years in the making. Sanada had been signed up for 8 years, with the Showrunners signed up for the past five years. This is why the show is great because you have actual screenwriters, producers and crew who care about the source material, who care about paying respect to the culture, who care about a craft that they put their heart and soul into. They're not just making a TV show to make the studio some money.Speaking about the writing, it is sublime. Obviously the culture of that era in Japan was rife with poets, but there are casual lines within the show that are just pure gold, e.g. ""if freedom is all you ever live for.. you will never be free of yourself"". This line was not expounded on nor brought up again later, it was just out there as one of many great lines to ponder over.The blood, guts, sex, profanity etc were all necessary in a show about feudal Japan. None of that was avoided. None of that was censored. That was perfect.The fact that the show was not adjusted for 2024 political correctness. For example, we hear men saying things like their wife is their property and they can choose to do what they want with her eg kill her, beat her, sleep with her whenever etc, and not only was this not tuned down, but it was left raw and plain to digest. The show left us audience to recognise that ""no, this is not how you correctly treat people"", ""this is gross"", ""this is disgusting"" etc. We don't need to be spoonfed into one of the characters speaking up about it not being right, the audience knows it's not right - and I love that they let us come to that conclusion.I think the main thing I love about this show is not actually about the show. It's about how the show is presented. This show was released weekly. This makes a huge impact on Shogun's appeal. I think this works in this shows favour because others have said this show felt rushed compared to the book. The Anjin is a prisoner trapped on foreign soil while the audience are trapped to wait another week for a new episode. We also feel like prisoners not able to ""binge watch"" the show. Anticipation is, I feel, key to why this show works so well.lastly: Anna Sawai. Omg she is fantastic in this role! Unbelievably gorgeous. She was completely lost in Monarch Legacy of Monsters, but OWNED this whole show. Her facial expression can convey a thousand words alone. She said in interviews she prefers roles like this that she has a deep connection with, and I hope for all our sakes she gets cast in many more heartfelt roles to come.Come to think of it, I haven't really heard any negative reviews about the show. One of the things that could've been improved on in the last episode is, I didn't buy Anjin's love for the people of Ajiro, at least not enough to kill himself over. We never see him talking to any of the townspeople the same way he had banter with Uejiro. I would've like to see him having a laugh with more of the help - the cooks, cleaners, fisherman, farmers etc as they're his kind of people: labourers.All in all, it is a fantastic show.From a writing, acting and production standpoint, I think it's the best show i have ever seen. Episode five and six are my personal favourites. I must admit I hyped myself up for all out war in the last episode and let myself down, but that was my own doing. I re-watched the final episode and aligned my perspectives, and it is so much better on a rewatch.10/10 Highly recommended!",10
"Can't recommend this show enough","When I first heard about Shogun I couldn't wait to see it because I absolutely loved the original. I then read the reviews and while the majority of them are really good they were still mixed enough that I thought I'd judge for myself? Well, I loved it. I loved it so much I'm already watching it all the way through again. I kept telling myself that there's no way they can keep every episode as entertaining as the last but they did. It just kept getting better and better. Like many have already said it's historically inaccurate. I can get past shows like that as long as it was entertaining enough and this definitely was.",10
"What, No Second Season?","Everything is Perfect in this TV Series! Screen writers overdid themselves. Very nice Costumes, Great Scenery! Very Interesting traditions of the ancient Japan! Captivating Story Line! Good choice of the Cast! Tadanobu Asano is the most talented actor and Anna Sawai is the most Beautiful actress in this Show! In my humble opinion of course. After watching 8 episodes, I just don't want this Lovely Show to stop! I want to continue enjoying it! And please don't tell me, that they don't have enough Money to make season 2. And also I don't believe they wont find someone with Good Imagination, to invent the New and Interesting Story!",10
"It's okay - definitely not 9 out of 10","Was looking forward to this since December. And was very excited to see all of the 9 and 10 ratings.In my opinion this is an okay tv show, one very fitting with fx, but I will not be overly excited to watch the new episodes week on week.The score sounds like something from a daytime tv movie. Any ""tense"" scene has basic drums to try and build tension, which gives the whole show a rather cheap feel.To those comparing this to game of thrones need to go back and watch the first few episodes and remind yourselves how gripping it was.To summarise, it's okay but i wish I had watched it with slightly lower expectations.",10
"The series of the year without a doubt.","We are in the presence, perhaps, of the best series of 2024 despite having been there for so few months.What Shogun has generated may only have had precedents on TV since the time of Games of Thrones.A fantastic story, an incredible casting, unbeatable locations and a direction to take your hat off to.At times it is classified as slow but in my opinion it is a delight to feel the tension of each moment without having to resort to violence.Hiroyuki Sanada's performance is fantastic playing a Toranaga who does not show his cards until the end and leaves you wondering if he is the villain or hero of the story.The character of Yabushige is also portrayed magnificently and shows you the story of someone obsessed with death and who always tries to be on the most convenient side of history.Mariko Sama is another complex character, overwhelmed by the past, not wanting to die until the end of the story as part of the ""crimson sky"" plan that she dies based on the plans that Toranaga had been orchestrating a long time ago.Finally, the character of John, played by Cosmo Jarvis, has multidimensionality in terms of a person who at the end of the story perfectly understands the feeling of living and gradually stops being an arrogant Englishman thinking about war to being another puppet in the story of Toranaga.The secondary characters are all very good, special mention to chapter 4 when Buntaro gets drunk with John...god, the tension that was experienced was fantastic.The historical basis of the story is sublime, and perhaps the last chapter could be anticlimactic considering what chapters 7, 8 and 9 had been, but it still closes in a great way, we saw the result of what they were showing us.Great series.",9
"Finely detailed, engrossing","The effect when you watch such a finely detailed show as this is mesmerizing, it sucks you into the world and time ... and the culture.Before an actor utters a single word in any episode there is the fact and nature of the world building that has been done in order to give them a stage to perform on. In the case of Shogun what has been accomplished is astounding, but it really comes into its own when the camera is tight and the sets and shots are relatively tightly constrained. Up close this world is utterly convincing - the costuming extraordinary.The script is also exceptionally well written and manages to convey a deep sense of Japanese culture (primarily of the upper classes) - but also tells its story very economically - it provides ample opportunity for nuanced communication.This brings us to the actors and the director and cinematographer who captured these subtleties - not easy to do with a light touch, managed here very deftly. The result is a show not over burdened with dialogue that tells part of its story some of its most significant moments, with gesture and response, subtle character action, a glance here, a hand movement, a tilt of the body, or the sweeping swish of fabric before composure again. On this level the show and its actors are quite magnificent - but there is room for special mention.Anna Sawai as Mariko is as refined and elegant as you'd expect from a high born and well educated noblewoman of the era, she is thoroughly steeped in the culture, captured here in very fine detail - Sawai's minute control is truly something to behold - very special indeed. So also Hiroyuki Sanada as Lord Toranaga - another brilliant and subtle performance from this fine actor.I've read some nasty dismissal of Cosmo Jarvis' Blackthorne - they miss the point. Of course he is uncouth, brash, insensitive. Of course his energy clashes with everything around him and he seems clumsy and arrogant and a bit useless. That IS the point, and the reality. His character is completely out of time and place - culturally he may as well be on another planet. The way he walks and moves is an affront to centuries of careful aesthetic, the way he sits, the way he drinks, the way he looks at people - all a culture shock. English arrogance and insensitivity gets a turn in front of the mirror. Well done.This show is sensational and ticks all the boxes - brilliant work by all involved. Not to be missed.",9
"The Failure to Deliver","It was well made, but they set up so many things to happen that just don't go anywhere. The main conflicts lead nowhere ultimately. Another thing I don't understand is that this is a very common observation and they still give it a 9 or 10. This show deserves to be reflected accurately, and a 7.8 would make more sense than the current 8.8, given that nothing that is set up leads anywhere.The acting was good, the cinematography was good. But again the lack of delivery on set ups is just silly. There are two or three instances of set up, with small little resulting action from them, like a character dying. But then the major conflicts just die out. No attempts at giving action to em. So, again, it is misleading that this was given an 8.8.",7
"Oh Heck No!","I was so excited when I heard about this. I remembered adoring the 1980 version so much that it spurred me to read the novel.But oh my god. No, no, no, a thousands times no.Talk about unfaithful to the novel! $!?!RC was a great Blackthorne! CJ... not so much.The relationship between Mariko and Blackthorne, as written by Clavell - the engine that drives the novel and makes it great - is faithfully represented in the 1980s version but completely bastardized in this dreadful remake. I was heartbroken when Mariko died in the original version; I felt absolutely nothing this time around - which pretty much says it all.Last but not least... the 1980s version was filmed entirely in Japan. The remake? Filmed entirely in... British Columbia. #facepalm.",3
